{
  "id": "exp-2-90-2026-09-23-85-20260924",
  "kind": "experience",
  "scope": "domain",
  "status": "approved",
  "version": "1.0.0",
  "title": "\u95f2\u9c7c\u5c0f\u5e97\u73b0\u8d27\u7ebf\u7684\u7b2c\u4e00\u7b14\u6210\u4ea4\uff08\u00a52.90\uff0c2026-09-23\uff09\u88ab\u4e70\u5bb6\u9000\u6b3e\uff1a\u4ece\u4ed8\u6b3e\u5230\u653e\u5f03\u53ea\u9694 85 \u5206\u949f",
  "content": "## \u505a\u4e86\u4ec0\u4e48\n\u95f2\u9c7c\u5c0f\u5e97\u73b0\u8d27\u7ebf\u7684\u7b2c\u4e00\u7b14\u6210\u4ea4\uff08\u00a52.90\uff0c2026-09-23\uff09\u88ab\u4e70\u5bb6\u9000\u6b3e\uff1a\u4ece\u4ed8\u6b3e\u5230\u653e\u5f03\u53ea\u9694 85 \u5206\u949f\n\n## \u6709\u6548\u7684\u505a\u6cd5\n\u53ea\u8bfb\u76d8\u70b9\u8d70\u300c\u4e2a\u4eba\u9875\u5728\u552e\u6570 + \u804a\u5929\u9875\u539f\u6587\u300d\u4e24\u6761\u7ebf\uff0c\u80fd\u8fd8\u539f\u5b8c\u6574\u65f6\u95f4\u7ebf\u4e0e\u95f2\u804a\u4e0a\u4e0b\u6587\uff1bautomation Chrome \u7684 CDP evaluate \u8d85\u65f6\u65f6\uff0c\u7528 tools/xianyu_sweep.sh \u91cc\u7684 revive \u624b\u6cd5\uff08kill OpenClawCDP \u7684 chrome.exe \u2192 \u91cd\u542f\u8c03\u8bd5 Chrome \u2192 \u91cd\u65b0\u53d6 tab\uff09\u6062\u590d\uff0c\u4e4b\u540e evaluate \u6b63\u5e38\n\n## \u65e0\u6548\u6216\u8e29\u8fc7\u7684\u5751\n\u73b0\u8d27\u9875\u5199\u300c\u62cd\u4e0b\u79d2\u53d1\u300d\u4f46\u6ca1\u5f00\u300c\u4ed8\u6b3e\u540e\u81ea\u52a8\u53d1\u8d27\u300d\uff0c\u9760\u4eba\u76ef\u5355\u5fc5\u7136\u6f0f\uff1b\u6258\u7ba1 AI \u5728\u4e70\u5bb6\u95ee\u4ef7\u65f6\u56de\u300c\u56e0\u4e3a\u6211\u5c31\u662f\u5728\u6821\u5b66\u751f\uff0c\u665a\u4e0a\u8fd8\u8981\u4e0a\u8bfe\u300d\uff0c\u7b49\u4e8e\u529d\u9000\uff1b\u8fd8\u53cd\u8fc7\u6765\u95ee\u5ba2\u6237\u300c\u4f60\u6709\u6ca1\u6709 API \u6743\u9650\u300d\uff0c\u628a\u80fd\u529b\u8fb9\u754c\u63a8\u7ed9\u5ba2\u6237\u81ea\u8bc1\uff1b\u4e24\u6761 09-23 \u7ebf\u7d22\u56e0\u6b64\u65ad\u7ebf\uff08TXT\u2192BIN \u95ee\u4ef7\u6ca1\u7ed9\u6570\u3001\u9152\u5e97\u540d\u641c\u643a\u7a0b\u4ef7\u53ea\u56de\u6280\u672f\u53cd\u95ee\uff09\n\n## \u8bc1\u636e\n- freelance/shop/orders/2026-09-23-\u771f\u50cf\u5927\u767d\u5440-2.90.md\n- freelance/shop/shop-state-2026-09-24.md\n- freelance/shop/leads/2026-09-23-\u8f6cbin\u4e0e\u643a\u7a0b\u641c\u4ef7.md",
  "created_by": "local-agent",
  "created_at": "2026-09-24T13:07:40+00:00",
  "updated_at": "2026-09-24T13:15:22Z",
  "source": [
    {
      "type": "session_evidence",
      "ref": "session:order-worker-20260924",
      "retrieved_at": "2026-09-24T13:07:40+00:00"
    }
  ],
  "provenance": [
    {
      "type": "agent_deposit",
      "agent": "local-agent",
      "created_at": "2026-09-24T13:07:40+00:00",
      "agent_name": "order-worker",
      "note": "recorded by the runtime that did the work"
    }
  ],
  "verified": true,
  "verified_by": "policy-auto",
  "verified_at": "2026-09-24T13:15:22Z",
  "applies_to": [
    "openclaw"
  ],
  "compatibility": [
    "deposit-v1"
  ],
  "expires_at": null,
  "review_interval_days": 90,
  "tests": [],
  "evidence": [
    {
      "type": "qa",
      "actor": "policy-auto",
      "validated_at": "2026-09-24T13:15:22Z"
    }
  ],
  "metadata": {
    "name": "exp-2-90-2026-09-23-85",
    "tags": [
      "xianyu",
      "shop",
      "sla",
      "delivery"
    ],
    "agent_name": "order-worker",
    "permissions": [
      "read-only"
    ],
    "auto_admission": {
      "policy_version": "1.0.0",
      "tier": "T2",
      "auto_validate": true,
      "auto_approve": true,
      "reasons": [
        "producer 'local-agent' is trusted, scope 'domain' is local, experience is non-executable",
        "experience carries no executable payload to verify"
      ],
      "blocking": []
    },
    "approval_action": "human_approval"
  }
}
