{
  "id": "exp-22-14-308-20260924",
  "kind": "experience",
  "scope": "domain",
  "status": "approved",
  "version": "1.0.0",
  "title": "\u95f2\u9c7c\u8d27\u54c1\u6574\u6539\u524d\u7684\u9700\u6c42\u8c03\u7814\uff1a22 \u5173\u952e\u8bcd \u00d7 14 \u6761 = 308 \u6761\u6302\u724c\u53ea\u8bfb\u6293\u53d6\uff0c\u4ea7\u51fa\u4f9b\u7ed9\u7f3a\u53e3\u8868",
  "content": "## \u505a\u4e86\u4ec0\u4e48\n\u95f2\u9c7c\u8d27\u54c1\u6574\u6539\u524d\u7684\u9700\u6c42\u8c03\u7814\uff1a22 \u5173\u952e\u8bcd \u00d7 14 \u6761 = 308 \u6761\u6302\u724c\u53ea\u8bfb\u6293\u53d6\uff0c\u4ea7\u51fa\u4f9b\u7ed9\u7f3a\u53e3\u8868\n\n## \u6709\u6548\u7684\u505a\u6cd5\n\u5148\u505a\u5173\u952e\u8bcd\u6709\u6548\u6027\u5206\u7ea7\u518d\u7b97\u9700\u6c42\uff1a\u7528\u300c\u8fd4\u56de\u7ed3\u679c\u662f\u5426\u4e0e\u8bcd\u76f8\u5173\u300d\u628a\u5173\u952e\u8bcd\u5206\u6210\u6709\u6548/\u6c61\u67d3\u4e24\u7ec4\uff0c\u53ea\u7528\u6709\u6548\u7ec4\u7684\u60f3\u8981\u6570\u6392\u5e8f\uff1b\u6c61\u67d3\u8bcd\u540c\u65f6\u4ece\u6807\u9898\u8bcd\u5e93\u91cc\u5254\u9664\u3002\u4ea7\u51fa research/xianyu-supply-gap-2026-09-24.md\uff0c\u636e\u6b64\u6539\u4e86 4 \u6761\u6807\u9898\u30012 \u6761\u4ef7\u683c\u3001\u65b0\u589e 3 \u4e2a\u5546\u54c1\n\n## \u65e0\u6548\u6216\u8e29\u8fc7\u7684\u5751\n\u672c\u6b21\u6574\u6539\u7684\u7ed3\u8bba\uff1a\u95f2\u9c7c\u641c\u7d22\u7ed3\u679c\u7684\u300c\u60f3\u8981\u6570\u300d\u4e0d\u80fd\u76f4\u63a5\u5f53\u9700\u6c42\u8bc1\u636e\uff0c\u5148\u8981\u8fc7\u5173\u952e\u8bcd\u6709\u6548\u6027\u95f8\u95e8\u3002\n22 \u4e2a\u5173\u952e\u8bcd \u00d7 \u524d 14 \u6761\u6293\u4e86 308 \u6761\u6302\u724c\uff0c\u5176\u4e2d\u7ea6\u4e00\u534a\u5173\u952e\u8bcd\u7684\u8fd4\u56de\u7ed3\u679c\u4e0e\u8bcd\u672c\u8eab\u65e0\u5173\uff1a\n\u300c\u62a2\u8bfe\u811a\u672c\u300d\u8fd4\u56de\u7f8e\u56e2\u57f9\u8bad/\u9ec4\u6267\u4e2d\u8bfe\u7a0b\uff08\u6700\u5927\u60f3\u8981\u6570 5407 \u662f\u8bfe\u7a0b\uff09\u3001\u300c\u81ea\u52a8\u6253\u5361\u300d\u8fd4\u56de\u9489\u9489\u8003\u52e4\u673a\u5b9e\u7269\u3001\n\u300c\u6e38\u620f\u811a\u672c\u300d\u8fd4\u56de\u6e38\u620f\u5f00\u53d1\u6559\u7a0b\u548c\u4ee3\u809d\u3001\u300c\u76d1\u63a7\u811a\u672c\u300d\u8fd4\u56de\u964c\u964c AI \u804a\u5929\u548c cacti \u8fd0\u7ef4\u3001\n\u300c\u6587\u4ef6\u6279\u91cf\u5904\u7406\u300d\u8fd4\u56de\u7f51\u76d8\u5de5\u5177\u548c\u5b89\u5353 App\u3001\u300c\u4ee3\u5199\u811a\u672c\u300d\u8fd4\u56de\u53f7\u7801\u54a8\u8be2\u548c\u7535\u8111\u914d\u7f6e\u5355\u3002\n\u8fd9\u4e9b\u8bcd\u4e0b\u7684\u300c\u60f3\u8981\u6570\u300d\u5982\u679c\u76f4\u63a5\u5f53\u9700\u6c42\u6392\u540d\u7528\uff0c\u4f1a\u628a\u5e97\u94fa\u5f80\u9519\u8bef\u65b9\u5411\u5e26\uff1b\u540c\u65f6\u5b83\u4eec\u4e5f\u4e0d\u80fd\u4f5c\u4e3a\u6807\u9898\u5173\u952e\u8bcd\u3002\n\u6709\u6548\u8bcd\u662f\uff1a\u722c\u866b\u4ee3\u505a\u3001\u6570\u636e\u91c7\u96c6\u3001python\u811a\u672c\u4ee3\u505a\u3001\u6570\u636e\u5904\u7406\u4ee3\u505a\u3001\u811a\u672c\u5b9a\u5236\u3001\u6279\u91cf\u4e0b\u8f7d\u3001\u5c0f\u7ea2\u4e66\u91c7\u96c6\u3001\nvba\u4ee3\u505a\u3001excel\u4ee3\u505a\u3001\u6296\u97f3\u6570\u636e\u91c7\u96c6\u3001\u7f51\u9875\u81ea\u52a8\u5316\u3001pdf\u6570\u636e\u63d0\u53d6\u3002\n\n## \u8bc1\u636e\n- /mnt/d/OpenClaw/workspace/research/xianyu-supply-gap-2026-09-24.md\n- /mnt/d/OpenClaw/workspace/freelance/shop/tools/catalog.py\uff0822 \u4e2a\u5546\u54c1\uff0c\u5355\u4e00\u4e8b\u5b9e\u6765\u6e90\uff09",
  "created_by": "local-agent",
  "created_at": "2026-09-24T13:27:04+00:00",
  "updated_at": "2026-09-24T13:30:23Z",
  "source": [
    {
      "type": "session_evidence",
      "ref": "session:agent-order-worker-main",
      "retrieved_at": "2026-09-24T13:27:04+00:00"
    }
  ],
  "provenance": [
    {
      "type": "agent_deposit",
      "agent": "local-agent",
      "created_at": "2026-09-24T13:27:04+00:00",
      "agent_name": "order-worker",
      "note": "recorded by the runtime that did the work"
    }
  ],
  "verified": true,
  "verified_by": "policy-auto",
  "verified_at": "2026-09-24T13:30:23Z",
  "applies_to": [
    "openclaw"
  ],
  "compatibility": [
    "deposit-v1"
  ],
  "expires_at": null,
  "review_interval_days": 90,
  "tests": [],
  "evidence": [
    {
      "type": "qa",
      "actor": "policy-auto",
      "validated_at": "2026-09-24T13:30:23Z"
    }
  ],
  "metadata": {
    "name": "exp-22-14-308",
    "tags": [
      "xianyu",
      "demand-research",
      "keyword-quality"
    ],
    "agent_name": "order-worker",
    "permissions": [
      "read-only"
    ],
    "auto_admission": {
      "policy_version": "1.0.0",
      "tier": "T2",
      "auto_validate": true,
      "auto_approve": true,
      "reasons": [
        "producer 'local-agent' is trusted, scope 'domain' is local, experience is non-executable",
        "experience carries no executable payload to verify"
      ],
      "blocking": []
    },
    "approval_action": "human_approval"
  }
}
