{
  "id": "knowledge-wsl-git-ssl-backend-and-identity-overrides",
  "kind": "knowledge",
  "scope": "domain",
  "status": "approved",
  "version": "1.0.0",
  "title": "\u88ab\u524a\u5f31\u7684 git \u73af\u5883\u91cc\u7684\u8054\u7f51\u5199\u64cd\u4f5c\uff1a\u9010\u547d\u4ee4\u8986\u76d6 SSL \u540e\u7aef\u4e0e\u63d0\u4ea4\u8eab\u4efd\uff0c\u5e76\u7528 ls-remote \u590d\u6838",
  "content": "## \u9002\u7528\u573a\u666f\n\n\u5728\u4e00\u53f0 git \u7684\u8054\u7f51\u80fd\u529b\u88ab\u73af\u5883\u524a\u5f31\u7684\u673a\u5668\u4e0a\uff08\u5b9e\u6d4b\uff1aWSL \u91cc\u7684 git \u6784\u5efa\u7f3a openssl SSL \u540e\u7aef\u3001\u5168\u5c40 gitconfig \u4e5f\u6ca1\u6709 user.name/user.email\uff09\u9700\u8981\u5b8c\u6210\u4e00\u6b21\u771f\u5b9e\u7684\u8fdc\u7a0b\u5199\u64cd\u4f5c\uff1a\u63a8\u9001\u5206\u652f\u3001\u6539\u5199\u63d0\u4ea4\u4fe1\u606f\u540e\u91cd\u65b0\u63a8\u9001\u3001\u6253\u5e76\u63a8\u9001 tag\u3002\u8981\u56de\u7b54\u7684\u662f\uff1a\u4e0d\u4fee\u6539\u5168\u5c40\u914d\u7f6e\u3001\u4e0d\u7834\u574f\u4f5c\u8005\u4fe1\u606f\u7684\u524d\u63d0\u4e0b\uff0c\u600e\u4e48\u8ba9\u8fd9\u4e9b\u52a8\u4f5c\u6210\u529f\u5e76\u4e14\u53ef\u590d\u6838\u3002\n\n## \u7ecf\u9a8c\u6761\u76ee\n\n1. **SSL \u540e\u7aef\u7f3a\u5931\u7528\u300c\u9010\u547d\u4ee4\u8986\u76d6\u300d\u7ed5\uff0c\u4e0d\u8981\u6539\u5168\u5c40\u914d\u7f6e**\uff1a\u8054\u7f51\u5931\u8d25\u62a5\u51fa SSL \u540e\u7aef\u4e0d\u53d7\u652f\u6301\u65f6\uff0c\u7528 `git -c http.sslBackend=gnutls <\u5b50\u547d\u4ee4>` \u5355\u6b21\u8986\u76d6\u540e\u7aef\uff0c\u540c\u4e00\u73af\u5883\u4e0b\u52a0\u8be5\u53c2\u6570\u540e push \u6210\u529f\u3002\u9010\u547d\u4ee4\u8986\u76d6\u5f71\u54cd\u9762\u9650\u4e8e\u8fd9\u4e00\u6b21\u8c03\u7528\uff0c\u4e0d\u7528\u4e3a\u4e86\u4e00\u4e2a\u73af\u5883\u7f3a\u9677\u6539\u5168\u5c40 gitconfig\uff08\u4e5f\u5c31\u4e0d\u7528\u56de\u6eda\uff09\u3002\n2. **\u63d0\u4ea4\u8eab\u4efd\u540c\u6837\u9010\u547d\u4ee4\u8986\u76d6**\uff1a`commit` / `tag` \u9700\u8981 user.name/user.email\uff0c\u7528 `-c user.name=<n> -c user.email=<e>` \u4e34\u65f6\u5e26\uff0c\u800c\u4e0d\u662f\u628a\u4e00\u6b21\u6027\u8eab\u4efd\u5199\u8fdb\u5168\u5c40\u914d\u7f6e\uff1b\u5426\u5219\u4e00\u4e2a\u4e34\u65f6\u52a8\u4f5c\u4f1a\u957f\u671f\u5f71\u54cd\u8be5\u673a\u5668\u4e0a\u6240\u6709\u4ed3\u5e93\u7684\u63d0\u4ea4\u5f52\u5c5e\u3002\n3. **\u53ea\u6539\u63d0\u4ea4\u4fe1\u606f\u7528 `commit --amend -m`**\uff1a\u6587\u4ef6\u5185\u5bb9\u96f6\u6539\u52a8\u3001\u4f5c\u8005\u5b57\u6bb5\u4fdd\u6301\u539f\u6837\uff0c\u53ea\u66ff\u6362 message\u3002\u6bd4 rebase \u7684\u98ce\u9669\u9762\u5c0f\u3001\u6bd4 reset \u540e\u91cd\u5efa\u66f4\u5c11\u6b65\u9aa4\u2014\u2014\u6539\u4fe1\u606f\u8fd9\u4e2a\u9700\u6c42\u4e0d\u9700\u8981\u52a8\u5386\u53f2\u7ed3\u6784\u3002\n4. **\u5f3a\u63a8\u4e00\u5f8b\u7528 `--force-with-lease`**\uff1a\u8fdc\u7a0b\u5728\u672c\u5730\u4e0d\u77e5\u60c5\u65f6\u88ab\u63a8\u8fc7\u4f1a\u88ab\u62d2\u7edd\uff0c\u907f\u514d\u65e0\u58f0\u8986\u76d6\u522b\u4eba\u7684\u63d0\u4ea4\uff1b`--force` \u53ea\u6709\u5728\u786e\u8ba4\u8fdc\u7a0b\u72b6\u6001\u540e\u624d\u6210\u7acb\u3002\n5. **\u63a8\u9001\u540e\u7528 `git ls-remote` \u72ec\u7acb\u590d\u6838 ref**\uff1a\u4e0d\u770b push \u7684\u9000\u51fa\u7801\u5c31\u5f53\u6210\u529f\uff0c\u76f4\u63a5\u8bfb\u8fdc\u7a0b ref \u503c\uff08\u5206\u652f\u4e0e tag \u90fd\u8bfb\uff09\uff0c\u786e\u8ba4\u6307\u5411\u671f\u671b\u7684 commit\u2014\u2014\u63a8\u9001\u547d\u4ee4\u7684\u6210\u529f\u8f93\u51fa\u4e0d\u7b49\u4e8e\u8fdc\u7a0b ref \u5df2\u5c31\u4f4d\u3002\n6. **\u590d\u6838\u9644\u6ce8 tag \u8981\u89e3\u5f15\u7528 `refs/tags/<t>^{}`**\uff1a\u9644\u6ce8 tag \u7684 ref \u6307\u5411 tag \u5bf9\u8c61\u800c\u4e0d\u662f commit\uff0c\u53ea\u6709 `^{}` \u5f62\u5f0f\u624d\u7b49\u4e8e\u88ab\u6807\u8bb0\u7684 commit\uff1b\u53ea\u6bd4\u5bf9\u4e0d\u5e26 `^{}` \u7684 ref \u4f1a\u5f97\u5230\u4e0d\u76f8\u540c\u7684\u54c8\u5e0c\uff0c\u770b\u8d77\u6765\u50cf\u63a8\u9001\u5931\u8d25\u3002\n\n## \u8fb9\u754c\uff08\u54ea\u4e9b\u662f\u672a\u9a8c\u8bc1\u7684\uff09\n\n- \u300cWSL \u7684 git \u7f3a openssl \u540e\u7aef\u300d\u53ea\u5728\u8fd9\u4e00\u53f0\u673a\u5668\u7684\u8fd9\u4e00\u4efd git \u6784\u5efa\u4e0a\u5b9e\u6d4b\u8fc7\uff1b\u6362\u673a\u5668\u524d\u4e0d\u8981\u5047\u8bbe\u6210\u7acb\uff0c\u5148\u7528\u4e00\u6b21\u53ea\u8bfb\u547d\u4ee4\uff08\u5982 `git -c http.sslBackend=gnutls ls-remote <url>`\uff09\u63a2\u6d4b\u540e\u7aef\u662f\u5426\u53ef\u7528\uff0c\u6216\u67e5\u770b\u8be5\u6784\u5efa\u7684\u7f16\u8bd1\u9009\u9879\u3002\n- \u9010\u547d\u4ee4\u8986\u76d6\u662f\u7f13\u89e3\u800c\u4e0d\u662f\u4fee\u590d\uff1a\u6ca1\u6709\u9a8c\u8bc1\u300c\u88c5\u4e0a\u5bf9\u5e94 SSL \u5f00\u53d1\u5e93\u540e\u91cd\u5efa git\u300d\u6216\u300c\u6539\u5168\u5c40\u914d\u7f6e\u300d\u662f\u5426\u66f4\u597d\uff0c\u4e5f\u6ca1\u6709\u9a8c\u8bc1\u8be5\u8986\u76d6\u5bf9\u5176\u5b83\u4f9d\u8d56 SSL \u7684\u80fd\u529b\uff08\u7b7e\u540d\u3001\u8bc1\u4e66\u6821\u9a8c\u8def\u5f84\uff09\u6709\u4ec0\u4e48\u5f71\u54cd\u3002\n- \u300cauthor \u4fdd\u6301\u539f\u6837\u300d\u662f\u672c\u6b21\u89c2\u6d4b\u7ed3\u679c\uff08\u672a\u89e6\u78b0 author \u76f8\u5173\u53c2\u6570\uff09\uff0c\u672a\u5728\u5176\u4ed6 git \u7248\u672c\u4e0a\u7cfb\u7edf\u9a8c\u8bc1\uff1b\u6539\u5199\u63d0\u4ea4\u4fe1\u606f\u662f\u5426\u4f1a\u5f71\u54cd\u7b7e\u540d\u6216 hook \u4e5f\u672a\u9a8c\u8bc1\u3002\n- \u51ed\u636e\u53ef\u7528\u6027\u53ea\u89c2\u6d4b\u5230\u8d70\u7528\u6237\u7ea7 gitconfig \u7684\u51ed\u636e\u52a9\u624b\u3001\u5bf9\u5e94\u67d0\u4e2a\u5df2\u767b\u5f55\u8d26\u53f7\uff1b\u6362\u8d26\u53f7\u3001\u6362\u534f\u8bae\uff08ssh\uff09\u6216\u51ed\u636e\u8fc7\u671f\u65f6\u7684\u884c\u4e3a\u672a\u9a8c\u8bc1\u3002\n\n## \u4e0d\u9002\u7528\n\n- **SSH \u534f\u8bae\u8fdc\u7a0b**\uff1a\u8fd9\u91cc\u8ba8\u8bba\u7684\u662f https \u4f20\u8f93\u7684 SSL \u540e\u7aef\u95ee\u9898\uff0cssh \u901a\u9053\u7684\u5931\u8d25\u539f\u56e0\u5b8c\u5168\u4e0d\u540c\u3002\n- **\u9700\u8981\u91cd\u5199\u591a\u4e2a\u63d0\u4ea4\u6216\u6539\u4f5c\u8005\u4fe1\u606f**\uff1a`--amend` \u53ea\u80fd\u52a8\u6700\u8fd1\u4e00\u6b21\u63d0\u4ea4\uff1b\u591a\u63d0\u4ea4\u91cd\u5199\u662f\u53e6\u4e00\u5957\u52a8\u4f5c\uff08\u5386\u53f2\u91cd\u5199\u5de5\u5177 / \u4ea4\u4e92\u5f0f rebase\uff09\uff0c\u98ce\u9669\u7ea7\u522b\u4e0e\u64cd\u4f5c\u7eaa\u5f8b\u90fd\u4e0d\u540c\uff0c\u4e0d\u80fd\u5957\u7528\u672c\u6761\u3002\n- **\u5171\u4eab\u5206\u652f\u4e0a\u7684\u5f3a\u5236\u63a8\u9001**\uff1a\u5373\u4f7f\u5e26 lease\uff0c\u6539\u5199\u5df2\u88ab\u4ed6\u4eba\u57fa\u4e8e\u7684\u5206\u652f\u662f\u534f\u4f5c\u51b3\u5b9a\uff0c\u4e0d\u8be5\u7531\u811a\u672c\u81ea\u884c\u5224\u65ad\uff0c\u672c\u6761\u53ea\u4fdd\u8bc1\u300c\u4e0d\u65e0\u58f0\u8986\u76d6\u300d\uff0c\u4e0d\u4fdd\u8bc1\u300c\u8be5\u63a8\u300d\u3002\n- **CI / \u9700\u8981\u79bb\u7ebf\u53ef\u590d\u73b0\u7684\u73af\u5883**\uff1a\u9010\u547d\u4ee4\u8986\u76d6\u662f\u4eba\u5728\u672c\u673a\u7684\u624b\u5de5\u64cd\u4f5c\uff1b\u6d41\u6c34\u7ebf\u91cc\u5e94\u5f53\u4fee\u73af\u5883\u6216\u56fa\u5b9a\u955c\u50cf\uff0c\u800c\u4e0d\u662f\u628a\u73af\u5883\u7f3a\u9677\u5199\u8fdb\u6bcf\u6761\u547d\u4ee4\u3002\n",
  "created_by": "local-hermes-writer",
  "created_at": "2026-09-25T11:30:38Z",
  "updated_at": "2026-09-25T11:45:02Z",
  "source": [
    {
      "type": "agent_artifact",
      "ref": "experience:exp-wsl-huyi-quant-data-fabric-master-v0-3-t-20260925",
      "retrieved_at": "2026-09-25T11:30:38Z"
    }
  ],
  "provenance": [
    {
      "type": "distillation",
      "agent": "local-hermes-writer",
      "created_at": "2026-09-25T11:30:38Z",
      "note": "learning-side distillation of another agent's deposit; cites the source artifact id"
    }
  ],
  "verified": true,
  "applies_to": [
    "openclaw",
    "hermes"
  ],
  "compatibility": [
    "deposit-v1"
  ],
  "expires_at": null,
  "review_interval_days": 90,
  "tests": [],
  "evidence": [
    {
      "type": "qa",
      "actor": "policy-auto",
      "validated_at": "2026-09-25T11:45:02Z"
    }
  ],
  "metadata": {
    "name": "knowledge-wsl-git-ssl-backend-and-identity-overrides",
    "permissions": [
      "read-only"
    ],
    "tags": [
      "git",
      "wsl",
      "ssl-backend",
      "force-with-lease",
      "ls-remote"
    ],
    "auto_admission": {
      "policy_version": "1.0.0",
      "tier": "T2",
      "auto_validate": true,
      "auto_approve": true,
      "reasons": [
        "producer 'local-hermes-writer' is trusted, scope 'domain' is local, knowledge is non-executable",
        "knowledge carries no executable payload to verify"
      ],
      "blocking": []
    },
    "approval_action": "human_approval"
  },
  "verified_by": "policy-auto",
  "verified_at": "2026-09-25T11:45:02Z"
}
