{
  "id": "source-pit-repository-snapshot-20260916",
  "kind": "source",
  "scope": "project",
  "status": "validated",
  "version": "0.1.0",
  "title": "PIT repository read-only snapshot evidence",
  "content": "Read-only Phase 2 evidence from D:\\quant-data-project. Branch master, HEAD d9e00554195d7399dd92ce3ade2a77fbfced62f7, remote https://github.com/ducrheu/quant-data-fabric.git. Git status was clean during inspection via one-shot safe.directory configuration.",
  "created_by": "phase2-pit-revalidation",
  "created_at": "2026-09-16T00:00:00Z",
  "updated_at": "2026-09-16T15:48:07Z",
  "source": [
    {
      "type": "local_git_repository",
      "path": "D:\\quant-data-project",
      "branch": "master",
      "head": "d9e00554195d7399dd92ce3ade2a77fbfced62f7",
      "remote": "https://github.com/ducrheu/quant-data-fabric.git",
      "retrieved_at": "2026-09-16T00:00:00Z"
    }
  ],
  "provenance": [
    {
      "type": "read_only_repository_inspection",
      "created_by": "codex",
      "created_at": "2026-09-16T00:00:00Z",
      "note": "No checkout, pull, merge, commit, push, file write, or database write was performed."
    }
  ],
  "verified": false,
  "verified_by": null,
  "verified_at": null,
  "applies_to": [
    "pit-database",
    "quant-data-fabric"
  ],
  "compatibility": [
    "commit:d9e00554195d7399dd92ce3ade2a77fbfced62f7"
  ],
  "expires_at": null,
  "review_interval_days": 30,
  "tests": [
    {
      "name": "read-only-revalidation",
      "result": "pass"
    }
  ],
  "evidence": [
    {
      "claim": "event_time",
      "status": "CONFIRMED",
      "location": "README.md:11, src/domain/financial.py:12, src/repositories/financial.py:31, tests/test_financal_repository.py:24",
      "evidence": "Documented as report period; modeled as datetime; persisted in financial_fact; used in repository tests."
    },
    {
      "claim": "available_time",
      "status": "CONFIRMED",
      "location": "README.md:12, src/domain/financial.py:14, src/repositories/financial.py:119, tests/test_financal_repository.py:188",
      "evidence": "Documented as market first-known time; modeled and persisted; get_pit filters available_time <= as_of_time; future unavailable record returns None."
    },
    {
      "claim": "processing_time",
      "status": "CONFIRMED",
      "location": "src/domain/financial.py:16, src/repositories/financial.py:39, src/normalizers/financial.py:29",
      "evidence": "Modeled and persisted; normalizer maps it from raw.ingest_time."
    },
    {
      "claim": "revision_id",
      "status": "PARTIALLY_CONFIRMED",
      "location": "README.md:61, README.md:149, src/domain/financial.py:20, src/repositories/financial.py:56, tests/test_financal_repository.py:63",
      "evidence": "Implementation and tests support revision_id=2 and latest available version; README known limitation says revision_id currently defaults to/was planned as constant 1, creating documentation conflict."
    },
    {
      "claim": "look-ahead protection",
      "status": "CONFIRMED",
      "location": "README.md:15, src/repositories/financial.py:119, tests/test_financal_repository.py:188",
      "evidence": "Repository query gates rows by available_time <= as_of_time; test asserts unavailable future data returns None."
    },
    {
      "claim": "release-time example",
      "status": "CONFIRMED",
      "location": "README.md:17, tests/test_financal_repository.py:193-206",
      "evidence": "README example and tests cover an event_time later visible only after available_time."
    },
    {
      "claim": "repository_identity",
      "status": "CONFIRMED",
      "location": "git metadata",
      "evidence": "branch master, HEAD d9e00554195d7399dd92ce3ade2a77fbfced62f7, remote origin https://github.com/ducrheu/quant-data-fabric.git"
    },
    {
      "type": "qa",
      "actor": "phase2-qa",
      "validated_at": "2026-09-16T15:48:07Z"
    }
  ],
  "supersedes": null,
  "superseded_by": null,
  "metadata": {
    "production_code_modified": false,
    "pit_repository_modified": false
  }
}
