{
  "id": "exp-ai-augmented-com-whut-ai-augmented-com-j-20260928",
  "kind": "experience",
  "scope": "domain",
  "status": "approved",
  "version": "1.0.0",
  "title": "\u628a\u8d85\u661f\u5c0f\u96c5\u5e73\u53f0\uff08*.ai-augmented.com\uff0c\u5982 whut.ai-augmented.com \u7684 jx-web \u6559\u5b66\u7ad9\uff09\u4e00\u95e8\u8bfe\u7684\u8bfe\u4ef6 PDF \u6279\u91cf\u6293\u4e0b\u6765\u5e76\u62bd\u6210\u6587\u672c",
  "content": "## \u505a\u4e86\u4ec0\u4e48\n\u628a\u8d85\u661f\u5c0f\u96c5\u5e73\u53f0\uff08*.ai-augmented.com\uff0c\u5982 whut.ai-augmented.com \u7684 jx-web \u6559\u5b66\u7ad9\uff09\u4e00\u95e8\u8bfe\u7684\u8bfe\u4ef6 PDF \u6279\u91cf\u6293\u4e0b\u6765\u5e76\u62bd\u6210\u6587\u672c\n\n## \u6709\u6548\u7684\u505a\u6cd5\n\u2460 \u590d\u7528 Windows \u4fa7\u5e26 --remote-debugging-port \u7684 Chrome\uff0c\u4f46\u8fde\u63a5\u65b9\u5f0f\u6362\u6210 Node \u539f\u751f WebSocket \u76f4\u8fde CDP\uff1b\u2461 \u8d44\u6e90\u6811\u4e00\u6b21\u62ff\u5168\uff1aGET /api/jx-iresource/resource/queryCourseResources/v2?group_id=<gid> \u8fd4\u56de\u6574\u68f5\u76ee\u5f55\u6811\uff0c\u542b\u6bcf\u4e2a\u6587\u4ef6\u7684 id \u4e0e quote_id\uff1b\u2462 \u6240\u6709 /api/jx-* \u63a5\u53e3\u5fc5\u987b\u81ea\u5e26 Authorization: Bearer\uff0c\u503c\u53d6\u6d4f\u89c8\u5668 cookie \u91cc\u540d\u5b57\u542b access-token \u7684\u90a3\u4e00\u4e2a\uff0c\u53ea\u5e26 cookie \u4f1a 401\uff1b\u2463 \u4e0b\u8f7d\u5730\u5740\u4e0d\u5728 queryResource/v3 \u7684 disk_url \u4e0a\uff08\u90a3\u4e2a file_access \u63a5\u53e3\u5bf9 PDF \u53ea\u56de\u300e\u8be5\u8d44\u6e90\u4e0d\u652f\u6301\u9884\u89c8\u300f\uff09\uff0c\u6b63\u786e\u5165\u53e3\u662f GET /api/jx-oresource/cloud/file_down/<quote_id>/v3\uff1b\u2464 \u8be5\u63a5\u53e3\u8fd4\u56de\u7684 data \u662f base64\uff0c\u8981\u518d\u7528\u524d\u7aef /app/jx-web/assets/release-*.wasm \u7684 decode() \u89e3\u4e00\u5c42\u624d\u5f97\u5230\u542b download_url \u7684 JSON\uff0cdownload_url \u662f\u5e26\u7b7e\u540d\u7684 OSS \u76f4\u94fe\uff1b\u2465 \u90a3\u4e2a wasm \u7684\u5b9e\u4f8b\u5316\u5bfc\u5165\u5bf9\u8c61\u5199\u6210 { env: Object.setPrototypeOf({abort(){}}, Object.assign(Object.create(globalThis), {})) }\uff0c\u628a JS \u91cc encode/decode \u4e24\u5c42\u5305\u88c5\u7167\u6284\u5373\u53ef\u8c03\u7528\uff1b\u2466 \u62ff\u5230\u7b7e\u540d\u76f4\u94fe\u540e\u666e\u901a HTTP \u5ba2\u6237\u7aef\uff08curl / python urllib\uff09\u5373\u53ef\u4e0b\u8f7d\uff0c\u4e0d\u9700\u8981 cookie\uff1b\u2467 \u8bfe\u4ef6 PDF \u662f\u6587\u5b57\u578b\u5e7b\u706f\u7247\uff0c\u7528 pdfplumber \u62bd\u6587\u672c\u6548\u679c\u597d\n\n## \u65e0\u6548\u6216\u8e29\u8fc7\u7684\u5751\n\u2460 Playwright \u7684 connect_over_cdp \u8fde\u8fd9\u4e2a Chrome \u63e1\u624b\u8d85\u65f6\uff08WS \u8fde\u4e0a\u4f46\u4e0d\u56de\u5305\uff09\uff0c\u6362 Node \u539f\u751f WebSocket \u76f4\u8fde CDP \u540e\u6b63\u5e38\uff1b\u2461 CDP \u7684 /json/list \u8fd4\u56de\u5b57\u6bb5\u662f id \u4e0d\u662f targetId\uff0c\u76f4\u63a5\u62ff\u53bb Target.attachToTarget \u4f1a\u62a5 mandatory field missing\uff1b\u2462 \u4e0d\u5e26 Authorization \u5934\u8bf7\u6c42 /api/jx-iresource/* \u4e00\u5f8b 401\uff0c\u5149\u6709 cookie \u4e0d\u591f\uff1b\u2463 /api/jx-oresource/cloud/file_access/<quote_id> \u5bf9 PDF \u8fd4\u56de HTML\u300e\u8be5\u8d44\u6e90\u4e0d\u652f\u6301\u9884\u89c8\u300f\uff0c\u4e0d\u662f\u4e0b\u8f7d\u5730\u5740\uff1b\u2464 \u7528 JS \u5408\u6210 MouseEvent \u70b9\u5de6\u4fa7\u76ee\u5f55\u6811\u4e0d\u89e6\u53d1 React \u7684\u5904\u7406\u51fd\u6570\uff0c\u76f4\u63a5\u6539\u8c03\u63a5\u53e3\u66f4\u7701\u4e8b\uff1b\u2465 \u9875\u9762\u4e0a\u7684\u8bb2\u6b21\u540d\u548c\u8bfe\u4ef6\u7f16\u53f7\u9519\u4f4d\uff08\u7b2c\u4e00\u8bb2\u76ee\u5f55\u4e0b\u6302\u7684\u662f\u7b2c01\u3001\u7b2c02\u8bb2\u8bfe\u4ef6\uff09\uff0c\u6309\u76ee\u5f55\u540d\u627e\u6587\u4ef6\u4f1a\u627e\u9519\uff1b\u2466 \u6574\u6761\u94fe\u8def\u8f83\u957f\uff0c\u4efb\u4f55\u4e00\u6b65\u51ed\u76f4\u89c9\u731c\u7aef\u70b9\u90fd\u4f1a\u6d6a\u8d39\u65f6\u95f4\uff0c\u4f18\u5148\u4ece\u524d\u7aef JS bundle \u91cc grep \u7aef\u70b9\u8def\u5f84\n\n## \u8bc1\u636e\n- /mnt/d/OpenClaw/workspace/agents/mentor/tools/cdp-eval.cjs\uff08Node \u76f4\u8fde CDP \u7684\u4e07\u80fd\u6267\u884c\u5668\uff09\uff0ccdp-probe.cjs / cdp-sniff.cjs / cdp-click.cjs / cdp-shot.cjs\n- /mnt/d/OpenClaw/workspace/agents/mentor/tools/js/get-urls.js\uff08wasm decode + file_down/v3 \u53d6\u7b7e\u540d\u76f4\u94fe\uff09\n- /mnt/d/OpenClaw/workspace/learning/materials/R\u8bed\u8a00\u4e0e\u7edf\u8ba1/\uff085 \u4efd PDF \u5171 3.6MB + \u63d0\u53d6\u6587\u672c + \u8bfe\u7a0b\u5185\u5bb9\u63d0\u70bc.md\uff09",
  "created_by": "local-agent",
  "created_at": "2026-09-28T00:14:22+00:00",
  "updated_at": "2026-09-28T00:15:06Z",
  "source": [
    {
      "type": "session_evidence",
      "ref": "session:agent:mentor:20260928-xiaoya",
      "retrieved_at": "2026-09-28T00:14:22+00:00"
    }
  ],
  "provenance": [
    {
      "type": "agent_deposit",
      "agent": "local-agent",
      "created_at": "2026-09-28T00:14:22+00:00",
      "agent_name": "mentor",
      "note": "recorded by the runtime that did the work"
    }
  ],
  "verified": true,
  "verified_by": "policy-auto",
  "verified_at": "2026-09-28T00:15:06Z",
  "applies_to": [
    "openclaw"
  ],
  "compatibility": [
    "deposit-v1"
  ],
  "expires_at": null,
  "review_interval_days": 90,
  "tests": [],
  "evidence": [
    {
      "type": "qa",
      "actor": "policy-auto",
      "validated_at": "2026-09-28T00:15:06Z"
    }
  ],
  "metadata": {
    "name": "exp-ai-augmented-com-whut-ai-augmented-com-j",
    "tags": [
      "xiaoya",
      "chaoxing",
      "ai-augmented",
      "cdp",
      "scraping",
      "wasm"
    ],
    "agent_name": "mentor",
    "permissions": [
      "read-only"
    ],
    "auto_admission": {
      "policy_version": "1.0.0",
      "tier": "T2",
      "auto_validate": true,
      "auto_approve": true,
      "reasons": [
        "producer 'local-agent' is trusted, scope 'domain' is local, experience is non-executable",
        "experience carries no executable payload to verify"
      ],
      "blocking": []
    },
    "approval_action": "human_approval"
  }
}
