{
  "id": "knowledge-windows-python-env-from-wsl",
  "kind": "knowledge",
  "scope": "domain",
  "status": "approved",
  "version": "1.0.0",
  "title": "\u4ece WSL \u4fa7\u65e0\u4ea4\u4e92\u642d\u597d Windows \u4fa7 Python/GPU \u73af\u5883\uff08conda \u955c\u50cf\u7ed5 ToS\u3001pip site \u7ea7\u6e90\u3001torch cu126\u3001\u4ee5\u8bc1\u636e\u6536\u5c3e\uff09",
  "content": "## \u9002\u7528\u573a\u666f\n- \u76ee\u6807 Python \u73af\u5883\u88c5\u5728 **Windows \u4fa7**\uff08\u89e3\u91ca\u5668\u662f C:/... \u6216 /mnt/<\u76d8>/... \u4e0b\u7684 .exe\uff09\uff0c\u800c\u5f53\u524d\u53ea\u6709 WSL \u91cc\u7684 shell\uff1a\u65b0\u673a\u5668\u4e00\u6b21\u6027\u5efa\u73af\u5883\u3001\u6ca1\u6709\u5f00 GUI\uff08Anaconda Prompt\uff09\u7684\u4f59\u91cf\u3002\n- \u9700\u8981 GPU \u7248\u6df1\u5ea6\u5b66\u4e60\u6808\uff08torch\uff09\uff0c\u5e76\u4e14\u8981\u80fd\u4ece WSL \u4fa7\u65e0\u4ea4\u4e92\u5730\u628a\u6574\u5957\u88c5\u5b8c\u3001\u9a8c\u8bc1\u5b8c\u3002\n- \u4e0d\u9002\u7528\u4e8e\u7eaf WSL/Linux \u5185\u7684\u73af\u5883\uff1a\u90a3\u6761\u8def\u8d70 venv/apt \u5373\u53ef\uff0c\u4e0d\u9700\u8981 Windows \u4fa7\u4e8c\u8fdb\u5236\u4e0e conda \u955c\u50cf\u7ed5\u884c\u3002\n\n## \u7ecf\u9a8c\u6761\u76ee\uff08\u53ef\u6267\u884c\uff09\n1. \u4e0d\u5fc5\u5207\u5230 Anaconda Prompt\uff1aWSL \u53ef\u76f4\u63a5\u6267\u884c Windows \u4fa7\u4e8c\u8fdb\u5236\uff08interop\uff09\u3002\u7528 `/mnt/<drive>/Miniconda3/Scripts/conda.exe` \u5efa\u73af\u5883\uff0c\u88c5\u5b8c\u7528 `<prefix>/envs/<name>/python.exe` \u8dd1\uff0c\u8def\u5f84\u5168\u90e8\u7528 WSL \u89c6\u89d2\u5199\u3002\n2. conda 26.x \u5bf9 `repo.anaconda.com` \u9ed8\u8ba4\u6e90\u5f3a\u5236\u8981\u6c42\u63a5\u53d7\u670d\u52a1\u6761\u6b3e\uff0c\u975e\u4ea4\u4e92\u6267\u884c\u76f4\u63a5\u629b `CondaToSNonInteractiveError`\u3002\u7ed5\u5f00\u65b9\u5f0f\u662f\u663e\u5f0f\u6362\u901a\u9053\uff0c\u800c\u4e0d\u662f\u53bb\u66ff\u7528\u6237\u70b9\u540c\u610f\uff1a\n   `conda.exe create -n <name> python=3.12 --override-channels -c https://mirrors.tuna.tsinghua.edu.cn/anaconda/cloud/conda-forge/ -y`\n3. pip \u6e90\u7528 `pip config --site set global.index-url <mirror>`\uff1a\u53ea\u5199\u8fdb**\u8be5\u73af\u5883\u81ea\u5df1**\u7684 pip.ini\uff0c\u4e0d\u52a8\u5168\u5c40 pip \u914d\u7f6e\uff0c\u591a\u73af\u5883\u5e76\u5b58\u65f6\u4e0d\u4f1a\u4e92\u76f8\u8986\u76d6\u3002\n4. GPU \u7248 torch \u7528\u5b98\u65b9 wheel \u7d22\u5f15\u88c5\uff0cCUDA \u4ee3\u53f7\u5fc5\u987b\u4e0e\u9a71\u52a8\u5339\u914d\uff1a\n   `<python.exe> -m pip install torch torchvision --index-url https://download.pytorch.org/whl/cu126`\n   \u5b9e\u6d4b\u9a71\u52a8 566.07 \u5bf9\u5e94 cu126\uff1bcu128 \u53ca\u4ee5\u4e0a\u9700\u8981 570+ \u9a71\u52a8\uff08\u5426\u5219\u88c5\u4e86\u4e5f\u8dd1\u4e0d\u8d77\u6765\uff09\u3002\n5. \u9a8c\u8bc1\u843d\u5230\u8bc1\u636e\u800c\u4e0d\u662f\"\u88c5\u5b8c\u4e86\"\uff1a`python.exe -c \"import torch; print(torch.__version__, torch.cuda.is_available())\"`\uff0c\u518d\u8dd1\u4e00\u6b21\u771f\u5b9e GPU \u77e9\u9635\u4e58\u6cd5\u8ba1\u65f6\uff08\u5b9e\u6d4b 3000x3000 \u7ea6 0.15s\uff1a\u7248\u672c\u53f7 + \u53ef\u7528\u6027 + \u4e00\u6b21\u771f\u5b9e\u7b97\u529b\uff0c\u4e09\u6837\u624d\u7b97\u8bc1\u660e\uff09\u3002\n6. \u67e5 Windows \u4fa7 PATH/\u73af\u5883\u53d8\u91cf\u8981\u4ee5\u6ce8\u518c\u8868 `HKCU\\Environment` \u4e3a\u51c6\uff1b\u5728 WSL \u91cc\u8c03 `cmd.exe` \u62ff\u5230\u7684 `where`/\u73af\u5883\u662f\u8fc7\u671f\u5feb\u7167\uff0c\u4f1a\u7ed9\u51fa\"\u627e\u4e0d\u5230 conda\"\u8fd9\u7c7b\u5047\u9634\u6027\u3002\n\n## \u8fb9\u754c\uff08\u672a\u9a8c\u8bc1\uff09\n- \u5355\u673a\u4e00\u6b21\u6027\u5b9e\u6d4b\uff08Windows \u4fa7 Miniconda\u3001conda 26.7.1\u3001Python 3.12.14\u3001\u9a71\u52a8 566.07\uff09\uff0c\u672a\u5728\u591a conda \u7248\u672c\u3001\u591a\u955c\u50cf\u3001\u591a\u9a71\u52a8\u7ec4\u5408\u4e0a\u590d\u73b0\u3002\n- \u4e0b\u8f7d\u901f\u5ea6\u662f\u89c2\u6d4b\u503c\u800c\u975e\u627f\u8bfa\uff1a2.6GB wheel \u5728\u56fd\u5185\u7ebf\u8def\u7ea6 3.8MB/s\u3001\u7ea6 9 \u5206\u949f\uff0c\u968f\u7ebf\u8def\u4e0e\u955c\u50cf\u53d8\u5316\u3002\n- \u7528 conda-forge \u955c\u50cf\u7ed5\u5f00 ToS \u7684\u957f\u671f\u7a33\u5b9a\u6027\u4e0e\u5408\u89c4\u6027\u672a\u8bc4\u4f30\uff1bToS \u672c\u8eab\u662f\u6cd5\u5f8b\u4e8b\u9879\uff0c\u4e0d\u7531 agent \u4ee3\u66ff\u7528\u6237\u63a5\u53d7\u3002\n- jupyter kernelspec \u6ce8\u518c\u53ea\u9700\u4e00\u6b21\u6210\u529f\u8bb0\u5f55\u5373\u53ef\u590d\u73b0\uff0c\u672a\u8de8\u673a\u5668\u9a8c\u8bc1\u3002\n\n## \u4e0d\u9002\u7528\n- **\u4e0d\u8981\u66ff\u7528\u6237\u63a5\u53d7 Anaconda \u670d\u52a1\u6761\u6b3e**\uff1a\u90a3\u662f\u6cd5\u5f8b\u884c\u4e3a\u3002\u8981\u4e48\u6539\u8d70 conda-forge/\u955c\u50cf\uff0c\u8981\u4e48\u8ba9\u672c\u4eba\u64cd\u4f5c\u3002\n- \u4e0d\u9002\u7528\u4e8e\u751f\u4ea7\u670d\u52a1\u5668\u4e0e CI\uff1a\u90a3\u91cc\u5e94\u9501\u5b9a\u4f9d\u8d56\u6587\u4ef6\u4e0e\u56fa\u5b9a\u6e90\uff0c\u957f\u671f `--override-channels` \u4f1a\u628a\u73af\u5883\u53d8\u6210\u4e0d\u53ef\u590d\u73b0\u7684\u4e00\u6b21\u6027\u73b0\u573a\u3002\n- \u4e0d\u9002\u7528\u4e8e\u9700\u8981 `nvcc` \u7f16\u8bd1\u81ea\u5b9a\u4e49 CUDA \u6269\u5c55\u7684\u573a\u666f\uff1apip \u7248 torch \u8f6e\u5b50\u4e0d\u5e26 CUDA toolkit\u3002\n",
  "created_by": "local-hermes-writer",
  "created_at": "2026-09-27T11:32:02Z",
  "updated_at": "2026-09-27T11:45:07Z",
  "source": [
    {
      "type": "agent_artifact",
      "ref": "experience:exp-windows-miniconda-dl-python-3-12-14-nump-20260927",
      "retrieved_at": "2026-09-27T11:32:02Z"
    }
  ],
  "provenance": [
    {
      "type": "distillation",
      "agent": "local-hermes-writer",
      "created_at": "2026-09-27T11:32:02Z"
    }
  ],
  "verified": true,
  "applies_to": [
    "openclaw",
    "hermes"
  ],
  "compatibility": [
    "deposit-v1"
  ],
  "review_interval_days": 90,
  "tests": [],
  "evidence": [
    {
      "type": "qa",
      "actor": "policy-auto",
      "validated_at": "2026-09-27T11:45:07Z"
    }
  ],
  "metadata": {
    "name": "knowledge-windows-python-env-from-wsl",
    "tags": [
      "windows",
      "wsl",
      "conda",
      "pytorch",
      "\u73af\u5883\u914d\u7f6e"
    ],
    "auto_admission": {
      "policy_version": "1.0.0",
      "tier": "T2",
      "auto_validate": true,
      "auto_approve": true,
      "reasons": [
        "producer 'local-hermes-writer' is trusted, scope 'domain' is local, knowledge is non-executable",
        "knowledge carries no executable payload to verify"
      ],
      "blocking": []
    },
    "approval_action": "human_approval"
  },
  "verified_by": "policy-auto",
  "verified_at": "2026-09-27T11:45:07Z"
}
