{
  "id": "exp-windows-miniconda-dl-python-3-12-14-nump-20260927",
  "kind": "experience",
  "scope": "domain",
  "status": "approved",
  "version": "1.0.0",
  "title": "\u5728 Windows \u4fa7\u4e3a\u5c0f\u4e3b\u4eba\u5efa\u597d Miniconda \u7684 dl \u73af\u5883\uff08Python 3.12.14 + numpy/matplotlib/jupyter + PyTorch cu126 GPU \u7248\uff09\uff0c\u5168\u7a0b\u4ece WSL \u4fa7\u5b8c\u6210",
  "content": "## \u505a\u4e86\u4ec0\u4e48\n\u5728 Windows \u4fa7\u4e3a\u5c0f\u4e3b\u4eba\u5efa\u597d Miniconda \u7684 dl \u73af\u5883\uff08Python 3.12.14 + numpy/matplotlib/jupyter + PyTorch cu126 GPU \u7248\uff09\uff0c\u5168\u7a0b\u4ece WSL \u4fa7\u5b8c\u6210\n\n## \u6709\u6548\u7684\u505a\u6cd5\n\u2460 WSL \u91cc\u76f4\u63a5\u8c03\u7528 Windows \u4fa7\u4e8c\u8fdb\u5236\uff1a/mnt/d/Miniconda3/Scripts/conda.exe \u4e0e envs/dl/python.exe\uff0cinterop \u53ef\u7528\uff0c\u4e0d\u5fc5\u5f00 Anaconda Prompt\uff1b\u2461 \u65b0\u7248 conda\uff0826.7.1\uff09\u5bf9 repo.anaconda.com \u9ed8\u8ba4\u6e90\u5f3a\u5236\u8981\u6c42\u63a5\u53d7\u670d\u52a1\u6761\u6b3e\uff0c\u975e\u4ea4\u4e92\u6267\u884c\u76f4\u63a5\u62a5 CondaToSNonInteractiveError\uff1b\u7528 --override-channels -c https://mirrors.tuna.tsinghua.edu.cn/anaconda/cloud/conda-forge/ \u53ef\u5b8c\u5168\u7ed5\u5f00\uff1b\u2462 pip \u7528 pip config --site set global.index-url \u53ea\u5199\u8fdb\u5355\u4e2a\u73af\u5883\u81ea\u5df1\u7684 pip.ini\uff0c\u4e0d\u6c61\u67d3\u5168\u5c40 pip \u914d\u7f6e\uff1b\u2463 GPU \u7248 torch \u88c5\u6cd5\uff1apip install torch torchvision --index-url https://download.pytorch.org/whl/cu126\uff08\u9a71\u52a8 566.07 \u5bf9\u5e94 CUDA 12.6\uff1bcu128 \u53ca\u4ee5\u4e0a\u9700 570+ \u9a71\u52a8\uff09\uff1b\u56fd\u5185\u4e0b\u8f7d 2.6GB \u7ea6 3.8MB/s\u30019 \u5206\u949f\n\n## \u65e0\u6548\u6216\u8e29\u8fc7\u7684\u5751\n\u2460 \u76f4\u63a5 conda create -n dl python=3.12 -y \u88ab ToS \u62e6\u6b7b\uff0c\u6362 conda-forge \u955c\u50cf\u5373\u53ef\uff1b\u2461 \u4e0d\u8981\u66ff\u7528\u6237\u70b9\u540c\u610f Anaconda \u670d\u52a1\u6761\u6b3e\u2014\u2014\u90a3\u662f\u6cd5\u5f8b\u884c\u4e3a\uff0c\u8981\u4e48\u6539\u7528 conda-forge\uff0c\u8981\u4e48\u8ba9\u672c\u4eba\u64cd\u4f5c\uff1b\u2462 \u5728 WSL \u91cc\u7528 cmd.exe \u67e5 PATH \u4f1a\u62ff\u5230\u8fc7\u671f\u73af\u5883\u5feb\u7167\uff08where conda \u62a5\u627e\u4e0d\u5230\uff09\uff0c\u67e5\u6ce8\u518c\u8868 HKCU Environment \u624d\u51c6\n\n## \u8bc1\u636e\n- /mnt/d/Miniconda3/envs/dl/python.exe \u5b9e\u6d4b\uff1atorch 2.14.0+cu126\uff0ccuda_available True\uff0cGPU \u4e0a 3000x3000 \u77e9\u9635\u4e58\u6cd5 0.15s\n- kernelspec \u5df2\u6ce8\u518c\uff1aC:/Users/HUYI/AppData/Roaming/jupyter/kernels/dl",
  "created_by": "local-agent",
  "created_at": "2026-09-27T11:06:47+00:00",
  "updated_at": "2026-09-27T11:15:07Z",
  "source": [
    {
      "type": "session_evidence",
      "ref": "session:agent:mentor:dashboard",
      "retrieved_at": "2026-09-27T11:06:47+00:00"
    }
  ],
  "provenance": [
    {
      "type": "agent_deposit",
      "agent": "local-agent",
      "created_at": "2026-09-27T11:06:47+00:00",
      "agent_name": "mentor",
      "note": "recorded by the runtime that did the work"
    }
  ],
  "verified": true,
  "verified_by": "policy-auto",
  "verified_at": "2026-09-27T11:15:07Z",
  "applies_to": [
    "openclaw"
  ],
  "compatibility": [
    "deposit-v1"
  ],
  "expires_at": null,
  "review_interval_days": 90,
  "tests": [],
  "evidence": [
    {
      "type": "qa",
      "actor": "policy-auto",
      "validated_at": "2026-09-27T11:15:07Z"
    }
  ],
  "metadata": {
    "name": "exp-windows-miniconda-dl-python-3-12-14-nump",
    "tags": [
      "conda",
      "windows",
      "wsl",
      "pytorch",
      "\u73af\u5883\u914d\u7f6e"
    ],
    "agent_name": "mentor",
    "permissions": [
      "read-only"
    ],
    "auto_admission": {
      "policy_version": "1.0.0",
      "tier": "T2",
      "auto_validate": true,
      "auto_approve": true,
      "reasons": [
        "producer 'local-agent' is trusted, scope 'domain' is local, experience is non-executable",
        "experience carries no executable payload to verify"
      ],
      "blocking": []
    },
    "approval_action": "human_approval"
  }
}
