{
  "id": "knowledge-kol-brand-placement-appearance-recompute",
  "kind": "knowledge",
  "scope": "domain",
  "status": "approved",
  "version": "1.0.0",
  "title": "\u5e73\u53f0\u65b9\u690d\u5165\uff1a\u5ba2\u6237\u5267\u60c5\u81ea\u5e26 App \u9732\u51fa\u65f6\uff0c\u6309\u54c1\u724c\u5224\u5b9a\u53e3\u5f84\u91cd\u7b97\u300c\u690d\u5165\u51fa\u73b0\u65f6\u95f4\u300d",
  "content": "# \u5e73\u53f0\u65b9\u690d\u5165\uff1a\u5ba2\u6237\u5267\u60c5\u81ea\u5e26 App \u9732\u51fa\u65f6\uff0c\u6309\u54c1\u724c\u5224\u5b9a\u53e3\u5f84\u91cd\u7b97\u300c\u690d\u5165\u51fa\u73b0\u65f6\u95f4\u300d\n\n## \u9002\u7528\u573a\u666f\n- \u54c1\u724c\u65b9/\u5e73\u53f0\u65b9\u7ed9\u7684\u662f\u690d\u5165 brief\uff08\u4e0d\u662f\u6210\u7247\uff09\uff0c\u4e14\u5ba2\u6237\u6216\u8fbe\u4eba\u5267\u60c5\u672c\u8eab\u5df2\u5e26 App/\u54c1\u724c\u9732\u51fa\uff0c\u9700\u5224\u5b9a\u300c\u54c1\u724c\u51fa\u73b0\u65f6\u95f4\u300d\u662f\u5426\u6ee1\u8db3\u300c\u4e0d\u665a\u4e8e\u5168\u7247\u524d 1/3\u300d\u4e00\u7c7b\u786c\u7ea6\u675f\u3002\n- \u8fbe\u4eba/\u77ed\u89c6\u9891\u690d\u5165\u811a\u672c\u4ea4\u4ed8\u524d\uff0c\u5fc5\u987b\u6309\u54c1\u724c\u53ef\u6838\u7684\u5224\u5b9a\u53e3\u5f84\u590d\u6838\u51fa\u73b0\u65f6\u95f4\uff0c\u800c\u4e0d\u662f\u51ed\u300c\u5267\u60c5\u91cc\u51fa\u73b0\u4e86\u54c1\u724c\u300d\u7684\u8089\u773c\u89c2\u611f\u3002\n\n## \u7ecf\u9a8c\u6761\u76ee\uff08\u53ef\u6267\u884c\uff09\n1. \u5148\u8bfb brief \u91cc\u5bf9\u300c\u51fa\u73b0\u300d\u7684\u5224\u5b9a\u53e3\u5f84\uff0c\u628a\u53e3\u5f84\u5f53\u4f5c\u552f\u4e00\u53ef\u6838\u7684\u951a\u70b9\u3002\u672c\u4f8b\u53e3\u5f84\u53ea\u8ba4\u4e24\u79cd\uff1a\u84dd\u76d2\u4e2d\u6587\u9762\u7279\u5199 >=1.5s\uff1b\u6216\u53e3\u64ad\u63d0\u5230\u54c1\u724c + \u54c1\u724c\u5b57\u5e55\u3002\u5267\u60c5\u91cc\u6f14\u5458\u6253\u5f00 App \u4e0b\u5355**\u4e0d\u7b97**\u51fa\u73b0\u3002\n2. \u6309\u53e3\u5f84\u91cd\u7b97\u690d\u5165\u51fa\u73b0\u65f6\u95f4\u518d\u5224\u5408\u89c4\uff1a\u672c\u4f8b\u91cd\u7b97\u540e\u843d\u5230\u7b2c 65s\uff0c\u8d85\u51fa\u300c\u524d 1/3\u300d\u7ea6\u675f\u2014\u2014\u539f\u7a3f\u770b\u4f3c\u6ee1\u8db3\u3001\u6309\u53e3\u5f84\u624d\u66b4\u9732\u4e0d\u5408\u89c4\u3002\u6ca1\u91cd\u7b97\u524d\u4e0d\u8981\u62a5\u5408\u89c4\u3002\n3. \u4e0d\u52a8\u53f0\u8bcd\u7684\u4e09\u79cd\u89e3\u6cd5\uff08\u4f18\u5148 (a)\uff09\uff1a(a) \u5728\u5267\u60c5\u6bb5\u7684\u4e0b\u5355\u753b\u9762\u4e0a\u52a0\u4e00\u6761\u54c1\u724c\u5b57\u5e55\uff08\u53ea\u6539\u5b57\u5e55\u5c42\uff0c\u4e0d\u78b0\u53f0\u8bcd\uff09\uff1b(b) \u8ba9\u5ba2\u6237\u540c\u610f\u53e3\u64ad\u5e26\u4e00\u6b21\u54c1\u724c\u540d\uff1b(c) \u54c1\u724c\u8ba4\u754c\u9762\u9732\u51fa\u3002\n4. \u5267\u60c5\u539f\u7a3f\u9010\u5b57\u642c\u8fdb\u5206\u955c\u8868\u2460\uff1b\u642d\u6863\u53f0\u8bcd\u4fdd\u7559\uff0c\u4f46\u53ea\u5199\u8fbe\u4eba\u7684\u56de\u7b54\uff0c\u4e0d\u4ee3\u5199\u642d\u6863\u5185\u5bb9\u3002\n5. \u690d\u5165\u4f4d\u65f6\u957f\u653e\u4e0d\u4e0b\u5fc5\u63d0\u5185\u5bb9\u65f6\uff0c\u628a\u79d2\u6570\u5199\u6210\u5b9e\u9645\u6240\u9700\uff08\u5982 30s \u4f4d\u5199 37s\uff09\u5e76\u7ed9\u51fa\u65b9\u6848 A/B\uff0c\u800c\u4e0d\u662f\u5220\u5267\u60c5\u3002\n\n## \u8fb9\u754c\uff08\u54ea\u4e9b\u662f\u672a\u9a8c\u8bc1\u7684\uff09\n- \u300c\u51fa\u73b0\u300d\u7684\u4e24\u79cd\u5224\u5b9a\u53e3\u5f84\u662f**\u5f97\u7269**\u53ca\u5176 brief \u7684\u7279\u5b9a\u53e3\u5f84\uff0c\u672a\u9a8c\u8bc1\u662f\u5426\u9002\u7528\u4e8e\u5176\u4ed6\u5e73\u53f0/\u54c1\u724c\uff1b\u6362\u5e73\u53f0\u9700\u91cd\u65b0\u8bfb brief\u3002\n- \u300c\u52a0\u54c1\u724c\u5b57\u5e55\u300d\u7b49\u89e3\u6cd5\u53ea\u88ab\u8bb0\u5f55\u4e3a\u5bf9\u300c\u5267\u60c5\u5df2\u51fa\u73b0\u54c1\u724c\u5373\u5408\u89c4\u300d\u8fd9\u4e00\u9519\u8bef\u524d\u63d0\u7684\u66ff\u4ee3\u65b9\u6848\uff0c\u6b63\u89e3\u672c\u8eab\u662f\u5426\u88ab\u54c1\u724c\u521d\u5ba1\u901a\u8fc7\u672a\u7ecf\u5b8c\u6574\u6295\u653e\u9a8c\u8bc1\u3002\n- \u7b2c 65s \u7684\u7ed3\u8bba\u7ed1\u5b9a\u8be5\u6761\u811a\u672c\u7684\u603b\u65f6\u957f\u4e0e\u7ed3\u6784\uff0c\u4e0d\u80fd\u76f4\u63a5\u642c\u5230\u5176\u4ed6\u65f6\u957f/\u7ed3\u6784\u7684\u811a\u672c\u3002\n\n## \u4e0d\u9002\u7528\n- \u6ca1\u6709\u54c1\u724c\u5224\u5b9a\u53e3\u5f84\u7684\u7eaf\u521b\u610f\u811a\u672c\u3002\n- \u5267\u60c5\u672c\u8eab\u4e0d\u542b\u54c1\u724c\u9732\u51fa\u7684\u5e38\u89c4\u53e3\u64ad\u690d\u5165\uff08\u8d70\u5e38\u89c4\u53e3\u5f84\u5373\u53ef\uff09\u3002\n",
  "created_by": "local-hermes-writer",
  "created_at": "2026-10-01T14:31:03Z",
  "updated_at": "2026-10-01T14:45:53Z",
  "source": [
    {
      "type": "agent_artifact",
      "ref": "experience:exp-app-20260930",
      "retrieved_at": "2026-10-01T14:31:03Z"
    }
  ],
  "provenance": [
    {
      "type": "distillation",
      "agent": "local-hermes-writer",
      "created_at": "2026-10-01T14:31:03Z"
    }
  ],
  "verified": true,
  "applies_to": [
    "openclaw",
    "hermes"
  ],
  "compatibility": [
    "deposit-v1"
  ],
  "review_interval_days": 90,
  "tests": [],
  "evidence": [
    {
      "type": "qa",
      "actor": "policy-auto",
      "validated_at": "2026-10-01T14:45:53Z"
    }
  ],
  "metadata": {
    "name": "knowledge-kol-brand-placement-appearance-recompute",
    "tags": [
      "freelance",
      "brief",
      "brand-placement",
      "delivery"
    ],
    "auto_admission": {
      "policy_version": "1.0.0",
      "tier": "T2",
      "auto_validate": true,
      "auto_approve": true,
      "reasons": [
        "producer 'local-hermes-writer' is trusted, scope 'domain' is local, knowledge is non-executable",
        "knowledge carries no executable payload to verify"
      ],
      "blocking": []
    },
    "approval_action": "human_approval"
  },
  "verified_by": "policy-auto",
  "verified_at": "2026-10-01T14:45:53Z"
}
