{
  "id": "knowledge-xianyu-listing-autoship-and-reply-guardrails",
  "kind": "knowledge",
  "scope": "domain",
  "status": "approved",
  "version": "1.0.0",
  "title": "\u95f2\u9c7c\u7c7b\u5e97\u94fa\uff1a\u81ea\u52a8\u53d1\u8d27\u5f00\u5173\u4e0e\u8be2\u5355\u5e94\u7b54\u7684\u5b88\u95e8\u89c4\u5219\uff08\u9996\u5355 85 \u5206\u949f\u9000\u6b3e\u590d\u76d8\uff09",
  "content": "## \u9002\u7528\u573a\u666f\n\n\u5728\u4e8c\u624b/\u670d\u52a1\u7c7b\u5e73\u53f0\uff08\u95f2\u9c7c\u4e00\u7c7b\uff09\u7528\u81ea\u52a8\u5316\u6302\u5355\u3001\u5e76\u7531\u4eba\uff08\u6216\u6258\u7ba1 AI\uff09\u5728\u804a\u5929\u9875\u5e94\u7b54\u8be2\u5355\u65f6\uff1b\u5c24\u5176\u662f\u300c\u62cd\u4e0b\u79d2\u53d1\u300d\u8fd9\u7c7b\u627f\u8bfa\u5373\u65f6\u4ea4\u4ed8\u7684\u5546\u54c1\uff0c\u4ee5\u53ca\u9996\u5355\u8f6c\u5316\u9636\u6bb5\u3002\u56de\u7b54\u7684\u95ee\u9898\u662f\u300c\u4e3a\u4ec0\u4e48\u4e00\u5355\u6210\u4ea4\u4e86\u5374\u5728\u51e0\u5341\u5206\u949f\u5185\u88ab\u9000\u6b3e\u300d\u3002\n\n## \u7ecf\u9a8c\u6761\u76ee\n\n1. **\u4e0a\u67b6\u524d\u6838\u5bf9\u4e09\u4ef6\u4e8b\uff0c\u7f3a\u4e00\u4e0d\u4e0a\u67b6**\uff1a\u5546\u54c1\u9875\u7684\u4ea4\u4ed8\u627f\u8bfa\u3001\u540e\u53f0\u662f\u5426\u771f\u7684\u6253\u5f00\u4e86\u300c\u4ed8\u6b3e\u540e\u81ea\u52a8\u53d1\u8d27\u300d\u3001\u53d1\u8d27\u6240\u9700\u7269\u6599\uff08\u5e93\u5b58 / \u5151\u6362\u7801 / \u6587\u4ef6\uff09\u662f\u5426\u5df2\u5c31\u4f4d\u3002\u9875\u9762\u5199\u300c\u62cd\u4e0b\u79d2\u53d1\u300d\u800c\u540e\u53f0\u5f00\u5173\u6ca1\u5f00\u65f6\uff0c\u9760\u4eba\u76ef\u5355\u5fc5\u7136\u6f0f\u5355\u3002\n2. **\u5e97\u94fa\u72b6\u6001\u76d8\u70b9\u8d70\u4e24\u6761\u53ea\u8bfb\u7ebf\u5e76\u4ea4\u53c9**\uff1a\u4e2a\u4eba\u9875\u5728\u552e\u6570 + \u804a\u5929\u9875\u539f\u6587\u3002\u53ea\u770b\u5728\u552e\u6570\u4f1a\u6f0f\u6389\u4f1a\u8bdd\u91cc\u5df2\u7ecf\u53d1\u751f\u7684\u95ee\u4ef7\u4e0e\u9000\u6b3e\uff1b\u53ea\u770b\u804a\u5929\u8bb0\u5f55\u65e0\u6cd5\u786e\u8ba4\u6302\u5355\u662f\u5426\u4ecd\u5728\u3002\n3. **\u8be2\u5355\u5e94\u7b54\u4e09\u6761\u786c\u89c4\u5219**\uff1a(a) \u4e0d\u4e3b\u52a8\u81ea\u8ff0\u8eab\u4efd\u4e0e\u4f5c\u606f\u2014\u2014\u300c\u6211\u662f\u5728\u6821\u5b66\u751f\u3001\u665a\u4e0a\u8fd8\u8981\u4e0a\u8bfe\u300d\u8fd9\u7c7b\u5766\u767d\u5728\u4e70\u5bb6\u4fa7\u7b49\u4e8e\u529d\u9000\uff1b(b) \u4e0d\u628a\u80fd\u529b\u8fb9\u754c\u629b\u56de\u7ed9\u5ba2\u6237\u81ea\u8bc1\u2014\u2014\u53cd\u95ee\u300c\u4f60\u6709\u6ca1\u6709 API \u6743\u9650\u300d\u662f\u628a\u5224\u65ad\u8d23\u4efb\u63a8\u7ed9\u4e70\u5bb6\uff1b(c) \u62a5\u4ef7\u7c7b\u95ee\u9898\u5fc5\u987b\u7ed9\u51fa\u6570\u5b57\u6216\u660e\u786e\u4e0d\u63a5\uff0c\u4e0d\u5f97\u7528\u6280\u672f\u6027\u53cd\u95ee\u4ee3\u66ff\u7b54\u590d\u3002\n4. **\u65ad\u7ebf\u7ebf\u7d22\u8981\u5355\u72ec\u5f52\u6863\u5e76\u6807\u6ce8\u65ad\u56e0**\uff1a\u4e00\u6761\u7ebf\u7d22\u672a\u6210\u5355\u65f6\uff0c\u8bb0\u5f55\u5b83\u662f\u300c\u6ca1\u62a5\u4ef7\u300d\u300c\u6ca1\u80fd\u529b\u63a5\u300d\u8fd8\u662f\u300c\u8bdd\u672f\u529d\u9000\u300d\uff0c\u5426\u5219\u590d\u76d8\u65f6\u65e0\u6cd5\u533a\u5206\u3002\n5. **\u6d4f\u89c8\u5668\u81ea\u52a8\u5316\u7684 CDP evaluate \u8d85\u65f6\u6309\u590d\u4f4d\u6d41\u7a0b\u8d70**\uff1a\u6740\u6389\u8c03\u8bd5\u7528 Chrome \u5b9e\u4f8b \u2192 \u91cd\u542f\u5e26\u8c03\u8bd5\u7aef\u53e3\u7684 Chrome \u2192 \u91cd\u65b0\u53d6 tab \u2192 \u518d\u6267\u884c evaluate\u3002\u4e0d\u8981\u5728\u540c\u4e00\u4e2a tab \u4e0a\u53cd\u590d\u91cd\u8bd5\u540c\u4e00\u4e2a\u8868\u8fbe\u5f0f\u3002\n\n## \u8fb9\u754c\n\n- \u53ea\u6709\u4e00\u6b21\u89c2\u6d4b\uff08n=1\uff09\uff1a\u9996\u5355 \u00a52.90 \u5728\u4ed8\u6b3e\u540e 85 \u5206\u949f\u88ab\u9000\u6b3e\uff0c\u4e14\u672a\u5f00\u81ea\u52a8\u53d1\u8d27\u3002\u300c\u672a\u5f00\u81ea\u52a8\u53d1\u8d27\u5bfc\u81f4\u9000\u6b3e\u300d\u662f\u672c\u6b21\u63a8\u65ad\uff0c\u6ca1\u6709\u5bf9\u7167\u7ec4\uff0c\u4e5f\u6ca1\u6709\u5e73\u53f0\u4fa7\u540e\u53f0\u6570\u636e\u4ea4\u53c9\u9a8c\u8bc1\u3002\n- \u8be2\u5355\u8bdd\u672f\u4e09\u6761\u89c4\u5219\u662f\u4ece\u4e24\u6761\u65ad\u7ebf\u7ebf\u7d22\u53cd\u63a8\u7684\u7eaa\u5f8b\uff0c\u4e0d\u662f A/B \u5b9e\u9a8c\u7ed3\u8bba\uff1b\u300c\u6539\u8bdd\u672f\u80fd\u63d0\u9ad8\u6210\u4ea4\u300d\u672a\u7ecf\u9a8c\u8bc1\u3002\n- \u7b2c 5 \u6761\u7684\u8fdb\u7a0b\u540d/\u7aef\u53e3\u662f\u672c\u673a automation Chrome\uff08OpenClawCDP\uff09\u7684\u5177\u4f53\u73af\u5883\uff0c\u6362\u73af\u5883\u8981\u6309\u5b9e\u9645\u8fdb\u7a0b\u540d\u66ff\u6362\u3002\n- \u8bc1\u636e\u4e3a\u4ed3\u5e93\u5185\u7684\u8ba2\u5355\u8bb0\u5f55\u3001\u5e97\u94fa\u72b6\u6001\u5feb\u7167\u4e0e\u7ebf\u7d22\u7b14\u8bb0\uff0c\u5c5e\u81ea\u8bb0\u6570\u636e\u3002\n\n## \u4e0d\u9002\u7528\n\n- \u4e0d\u9700\u8981\u4eba\u5de5/\u6258\u7ba1\u5e94\u7b54\u3001\u53ea\u9760\u641c\u7d22\u6d41\u91cf\u7684\u7eaf\u94fa\u8d27\u578b\u5546\u54c1\u9875\u3002\n- \u5e73\u53f0\u5df2\u5f3a\u5236\u81ea\u52a8\u53d1\u8d27\u6216\u5546\u54c1\u672c\u8eab\u65e0\u9700\u4eba\u5de5\u4ea4\u4ed8\u7684\u54c1\u7c7b\u3002\n- \u628a\u4e0a\u9762\u7684\u8be2\u5355\u8bdd\u672f\u5f53\u6210\u4e70\u5bb6\u5fc3\u7406\u666e\u904d\u89c4\u5f8b\u4f7f\u7528\u2014\u2014\u5b83\u662f\u672c\u5e97\u7684\u5e94\u7b54\u7eaa\u5f8b\uff0c\u4e0d\u662f\u5bf9\u4eba\u6027\u7684\u7ed3\u8bba\u3002\n",
  "created_by": "local-hermes-writer",
  "created_at": "2026-09-24T23:31:37Z",
  "updated_at": "2026-09-24T23:45:34Z",
  "source": [
    {
      "type": "agent_artifact",
      "ref": "experience:exp-2-90-2026-09-23-85-20260924",
      "retrieved_at": "2026-09-24T23:31:37Z"
    }
  ],
  "provenance": [
    {
      "type": "distillation",
      "agent": "local-hermes-writer",
      "created_at": "2026-09-24T23:31:37Z",
      "note": "learning-side distillation of another agent's deposit; cites the source artifact id"
    }
  ],
  "verified": true,
  "applies_to": [
    "openclaw",
    "hermes"
  ],
  "compatibility": [
    "deposit-v1"
  ],
  "expires_at": null,
  "review_interval_days": 90,
  "tests": [],
  "evidence": [
    {
      "type": "qa",
      "actor": "policy-auto",
      "validated_at": "2026-09-24T23:45:34Z"
    }
  ],
  "metadata": {
    "name": "knowledge-xianyu-listing-autoship-and-reply-guardrails",
    "permissions": [
      "read-only"
    ],
    "auto_admission": {
      "policy_version": "1.0.0",
      "tier": "T2",
      "auto_validate": true,
      "auto_approve": true,
      "reasons": [
        "producer 'local-hermes-writer' is trusted, scope 'domain' is local, knowledge is non-executable",
        "knowledge carries no executable payload to verify"
      ],
      "blocking": []
    },
    "approval_action": "human_approval",
    "tags": [
      "xianyu",
      "auto-ship",
      "reply",
      "guardrails",
      "listing",
      "\u95f2\u9c7c",
      "\u81ea\u52a8\u53d1\u8d27",
      "\u56de\u590d"
    ]
  },
  "verified_by": "policy-auto",
  "verified_at": "2026-09-24T23:45:34Z"
}
