{
  "id": "exp-im-personal-tools-xianyu-patrol-sh-tab-t-20260925",
  "kind": "experience",
  "scope": "domain",
  "status": "approved",
  "version": "1.0.0",
  "title": "\u628a\u95f2\u9c7c\u5c0f\u5e97\u7684\u91cd\u590d\u5de1\u5e97\u52a8\u4f5c\uff08\u8bfb\u6d88\u606f\u9875 /im + \u6211\u7684\u95f2\u9c7c\u9875 /personal\uff0c\u6bd4\u5bf9\u4e0a\u6b21\u5feb\u7167\uff09\u505a\u6210\u96f6\u6a21\u578b\u811a\u672c\u94fe\uff1atools/xianyu_patrol.sh\uff08\u5f00\u4e34\u65f6 tab \u8bfb\u6b63\u6587\u3001\u5173 tab\uff09+ tools/xianyu_patrol_d",
  "content": "## \u505a\u4e86\u4ec0\u4e48\n\u628a\u95f2\u9c7c\u5c0f\u5e97\u7684\u91cd\u590d\u5de1\u5e97\u52a8\u4f5c\uff08\u8bfb\u6d88\u606f\u9875 /im + \u6211\u7684\u95f2\u9c7c\u9875 /personal\uff0c\u6bd4\u5bf9\u4e0a\u6b21\u5feb\u7167\uff09\u505a\u6210\u96f6\u6a21\u578b\u811a\u672c\u94fe\uff1atools/xianyu_patrol.sh\uff08\u5f00\u4e34\u65f6 tab \u8bfb\u6b63\u6587\u3001\u5173 tab\uff09+ tools/xianyu_patrol_diff.py\uff08\u53bb\u566a\u97f3/\u76f8\u5bf9\u65f6\u95f4/\u9875\u811a\u540e\u6bd4\u5bf9\uff0c\u6709\u53d8\u5316\u624d\u8f93\u51fa\u901a\u77e5\u6b63\u6587\uff0c\u5426\u5219\u8f93\u51fa NO_REPLY \u9759\u9ed8\u4ee4\u724c\uff09\uff0c\u6302\u5230 openclaw automations add --every 10m --command\uff08Gateway \u76f4\u63a5\u8dd1 sh\uff0c\u4e0d\u7ecf\u8fc7\u6a21\u578b\uff09\uff0c--announce \u6295\u9012\u5230 qqbot:c2c\n\n## \u6709\u6548\u7684\u505a\u6cd5\n\u7528 automation \u7684 command payload\uff08\u96f6\u6a21\u578b\u8c03\u7528\uff09\u800c\u4e0d\u662f agentTurn\uff1a\u6bcf 10 \u5206\u949f\u4e00\u6b21\u7684\u56fa\u5b9a\u52a8\u4f5c\u4e0d\u8be5\u8c03\u5927\u6a21\u578b\uff1b\u6709\u53d8\u5316\u624d announce\uff0c\u65e0\u53d8\u5316\u6253 NO_REPLY \u5c31\u4e0d\u56de\u5e16\uff1b\u9875\u9762\u8bfb\u7a7a\u8981\u8bb0\u8fde\u7eed\u5931\u8d25\u6b21\u6570\u3001\u6bcf 3 \u6b21\u624d\u62a5\u4e00\u6b21\uff0c\u5426\u5219 CDP \u62bd\u98ce\u65f6\u4f1a\u6bcf 10 \u5206\u949f\u5237\u4e00\u6761\uff1b\u6bd4\u5bf9\u903b\u8f91\u4ece shell \u91cc\u62c6\u51fa\u6765\u505a\u6210\u72ec\u7acb python \u6587\u4ef6\uff0c\u5c31\u80fd\u79bb\u7ebf\u5582\u5047\u9875\u9762\u8dd1\u6d4b\u8bd5\uff0c\u4e0d\u7528\u78b0 CDP \u4e5f\u80fd\u9a8c\u8bc1 and/or \u68c0\u6d4b\u903b\u8f91\n\n## \u65e0\u6548\u6216\u8e29\u8fc7\u7684\u5751\n\u7b2c\u4e00\u7248 diff \u628a\u300c\u6d88\u606f\u9875\u8bfb\u7a7a\u300d\u5f53\u6210 alert \u6bcf\u6b21\u90fd\u62a5\uff0c\u7ed3\u679c run3\uff08\u65e0\u53d8\u5316\uff09\u4e5f\u53d1\u901a\u77e5\uff0c\u53d8\u6210\u566a\u97f3\u6e90\uff1b\u53e6\u5916\u628a\u9608\u503c\u8bbe\u6210 250 \u5b57\uff0c\u79bb\u7ebf fixture \u53ea\u6709 118 \u5b57\uff0c\u5bfc\u81f4\u5047\u6570\u636e\u5168\u90e8\u8d70\u300c\u8bfb\u7a7a\u300d\u5206\u652f\uff0c\u6d4b\u8bd5\u4e00\u76f4\u5728\u9a8c\u9519\u5206\u652f\u2014\u2014\u9608\u503c\u8981\u6309\u771f\u5b9e\u9875\u9762\u957f\u5ea6\u73b0\u573a\u6807\u5b9a\uff08\u771f\u5b9e\u6d88\u606f\u9875 ~1600 \u5b57\uff09\uff0c\u4e0d\u80fd\u7167\u6284\u522b\u5904\u7684\u6570\n\n## \u8bc1\u636e\n- freelance/shop/tools/xianyu_patrol.sh\u3001freelance/shop/tools/xianyu_patrol_diff.py\uff08\u79bb\u7ebf 5 \u8f6e\u6d4b\u8bd5\u901a\u8fc7\uff1a\u5efa\u5feb\u7167/\u65b0\u6d88\u606f+\u5356\u51fa/\u65e0\u53d8\u5316/\u9875\u9762\u6b7b/\u6062\u590d\uff09\uff1bautomation job b9397fe4-0f6b-46fd-a277-c7ca6f747845 \u5b9e\u8dd1 exit 0\u3001\u8017\u65f6 30.9s\uff1bQQ \u901a\u9053\u7528\u4e00\u6b21\u6027 job \u9a8c\u8bc1 delivered=true",
  "created_by": "local-agent",
  "created_at": "2026-09-25T00:10:05+00:00",
  "updated_at": "2026-10-19T15:05:24Z",
  "source": [
    {
      "type": "session_evidence",
      "ref": "session:order-worker-20260925",
      "retrieved_at": "2026-09-25T00:10:05+00:00"
    }
  ],
  "provenance": [
    {
      "type": "agent_deposit",
      "agent": "local-agent",
      "created_at": "2026-09-25T00:10:05+00:00",
      "agent_name": "order-worker",
      "note": "recorded by the runtime that did the work"
    }
  ],
  "verified": true,
  "verified_by": "policy-auto",
  "verified_at": "2026-09-25T00:15:34Z",
  "applies_to": [
    "openclaw"
  ],
  "compatibility": [
    "deposit-v1"
  ],
  "expires_at": null,
  "review_interval_days": 90,
  "tests": [],
  "evidence": [
    {
      "type": "qa",
      "actor": "policy-auto",
      "validated_at": "2026-09-25T00:15:34Z"
    }
  ],
  "metadata": {
    "name": "exp-im-personal-tools-xianyu-patrol-sh-tab-t",
    "tags": [
      "xianyu",
      "automation",
      "zero-model",
      "monitoring"
    ],
    "agent_name": "order-worker",
    "permissions": [
      "read-only"
    ],
    "auto_admission": {
      "policy_version": "1.0.0",
      "tier": "T2",
      "auto_validate": true,
      "auto_approve": true,
      "reasons": [
        "producer 'local-agent' is trusted, scope 'domain' is local, experience is non-executable",
        "experience carries no executable payload to verify"
      ],
      "blocking": []
    },
    "approval_action": "human_approval"
  },
  "superseded_by": "knowledge-zero-model-patrol-automation-loop"
}
